{
  "schema_version": "1.0.0",
  "$schema": "https://raw.githubusercontent.com/eva01/qs-data/master/schemas/reference_table.schema.json",
  "category": "conversion-table",
  "data_type": "reference_table",
  "source": {
    "image": "whatsapp-image-2026-05-16-at-12-14-09.jpeg",
    "url": "https://quantitysurveyoronline.com.my/conversion-table.html",
    "ocr_engine": "gemini"
  },
  "data_date": "static",
  "extracted_at": "2026-05-18T03:43:21Z",
  "columns": [
    {
      "name": "dimension",
      "description": "Measurement dimension, e.g. AREA, LENGTH"
    },
    {
      "name": "from_unit",
      "description": "Source unit"
    },
    {
      "name": "to_unit",
      "description": "Target unit"
    },
    {
      "name": "multiplier",
      "description": "Multiply from_unit by this to get to_unit"
    }
  ],
  "row_count": 0,
  "quality_flags": [
    "unparsed_row: 'S/N' | 'No.'"
  ],
  "rows": []
}