{
  "schema_version": "1.0.0",
  "$schema": "https://raw.githubusercontent.com/eva01/qs-data/master/schemas/reference_table.schema.json",
  "category": "conversion-table",
  "data_type": "reference_table",
  "source": {
    "image": "2109606_orig.jpg",
    "url": "https://quantitysurveyoronline.com.my/conversion-table.html",
    "ocr_engine": "gemini"
  },
  "data_date": "static",
  "extracted_at": "2026-05-10T00:08:21Z",
  "columns": [
    {
      "name": "dimension",
      "description": "Measurement dimension, e.g. AREA, LENGTH"
    },
    {
      "name": "from_unit",
      "description": "Source unit"
    },
    {
      "name": "to_unit",
      "description": "Target unit"
    },
    {
      "name": "multiplier",
      "description": "Multiply from_unit by this to get to_unit"
    }
  ],
  "row_count": 17,
  "quality_flags": [],
  "rows": [
    {
      "row_id": "conversion-table:area:1",
      "dimension": "AREA",
      "from_unit": "Sq. Inches",
      "to_unit": "Sq. Centimetres",
      "multiplier": 6.4516
    },
    {
      "row_id": "conversion-table:area:2",
      "dimension": "AREA",
      "from_unit": "Sq. Feet",
      "to_unit": "Sq. Centimetres",
      "multiplier": 929.03
    },
    {
      "row_id": "conversion-table:area:3",
      "dimension": "AREA",
      "from_unit": "Sq. Feet",
      "to_unit": "Sq. Metres",
      "multiplier": 0.092903
    },
    {
      "row_id": "conversion-table:area:4",
      "dimension": "AREA",
      "from_unit": "Sq. Yards",
      "to_unit": "Sq. Metres",
      "multiplier": 0.8361
    },
    {
      "row_id": "conversion-table:area:5",
      "dimension": "AREA",
      "from_unit": "Sq. Miles",
      "to_unit": "Sq. Kilometres",
      "multiplier": 2.58999
    },
    {
      "row_id": "conversion-table:area:6",
      "dimension": "AREA",
      "from_unit": "Sq. Miles",
      "to_unit": "Hectares",
      "multiplier": 258.999
    },
    {
      "row_id": "conversion-table:area:7",
      "dimension": "AREA",
      "from_unit": "Sq. Millimetres",
      "to_unit": "Sq. Inches",
      "multiplier": 0.00155
    },
    {
      "row_id": "conversion-table:area:8",
      "dimension": "AREA",
      "from_unit": "Sq. Centimetres",
      "to_unit": "Sq. Inches",
      "multiplier": 0.155
    },
    {
      "row_id": "conversion-table:area:9",
      "dimension": "AREA",
      "from_unit": "Sq. Metres",
      "to_unit": "Sq. Feet",
      "multiplier": 10.7639
    },
    {
      "row_id": "conversion-table:area:10",
      "dimension": "AREA",
      "from_unit": "Sq. Metres",
      "to_unit": "Sq. Yards",
      "multiplier": 1.19599
    },
    {
      "row_id": "conversion-table:area:11",
      "dimension": "AREA",
      "from_unit": "Sq. Metres",
      "to_unit": "Acres",
      "multiplier": 0.000247105
    },
    {
      "row_id": "conversion-table:area:12",
      "dimension": "AREA",
      "from_unit": "Sq. Kilometres",
      "to_unit": "Sq. Metres",
      "multiplier": 0.3861
    },
    {
      "row_id": "conversion-table:area:13",
      "dimension": "AREA",
      "from_unit": "Sq. Kilometres",
      "to_unit": "Acres",
      "multiplier": 247.105
    },
    {
      "row_id": "conversion-table:area:14",
      "dimension": "AREA",
      "from_unit": "Hectares",
      "to_unit": "Acres",
      "multiplier": 2.47105
    },
    {
      "row_id": "conversion-table:area:15",
      "dimension": "AREA",
      "from_unit": "Hectares",
      "to_unit": "Sq. Feet",
      "multiplier": 107638.0
    },
    {
      "row_id": "conversion-table:area:16",
      "dimension": "AREA",
      "from_unit": "Acres",
      "to_unit": "Sq. Metres",
      "multiplier": 4046.856
    },
    {
      "row_id": "conversion-table:area:17",
      "dimension": "AREA",
      "from_unit": "Acres",
      "to_unit": "Hectares",
      "multiplier": 0.40469
    }
  ]
}