{
  "schema_version": "1.0.0",
  "$schema": "https://raw.githubusercontent.com/eva01/qs-data/master/schemas/reference_table.schema.json",
  "category": "rebar-kg-per-m",
  "data_type": "reference_table",
  "source": {
    "image": "9893010_orig.jpg",
    "url": "https://quantitysurveyoronline.com.my/rebar-kg-per-m.html",
    "ocr_engine": ""
  },
  "data_date": "static",
  "extracted_at": "2026-05-09T23:52:12Z",
  "columns": [
    {
      "name": "diameter_mm",
      "unit": "mm",
      "description": "Bar diameter in mm"
    },
    {
      "name": "cross_section_area_mm2",
      "unit": "mm²",
      "description": "Cross-sectional area"
    },
    {
      "name": "mass_per_m_kg",
      "unit": "kg/m",
      "description": "Mass per linear metre"
    },
    {
      "name": "mass_per_12m_kg",
      "unit": "kg/12m",
      "description": "Mass per 12-metre bar"
    }
  ],
  "row_count": 15,
  "quality_flags": [],
  "rows": [
    {
      "row_id": "rebar-kg-per-m:_:6",
      "diameter_mm": 6,
      "cross_section_area_mm2": 28.3,
      "mass_per_m_kg": 0.222,
      "mass_per_12m_kg": 2.664
    },
    {
      "row_id": "rebar-kg-per-m:_:9",
      "diameter_mm": 9,
      "cross_section_area_mm2": 63.6,
      "mass_per_m_kg": 0.499,
      "mass_per_12m_kg": 5.988
    },
    {
      "row_id": "rebar-kg-per-m:_:10",
      "diameter_mm": 10,
      "cross_section_area_mm2": 78.5,
      "mass_per_m_kg": 0.616,
      "mass_per_12m_kg": 7.392
    },
    {
      "row_id": "rebar-kg-per-m:_:12",
      "diameter_mm": 12,
      "cross_section_area_mm2": 113.1,
      "mass_per_m_kg": 0.888,
      "mass_per_12m_kg": 10.656
    },
    {
      "row_id": "rebar-kg-per-m:_:13",
      "diameter_mm": 13,
      "cross_section_area_mm2": 132.7,
      "mass_per_m_kg": 1.042,
      "mass_per_12m_kg": 12.504
    },
    {
      "row_id": "rebar-kg-per-m:_:14",
      "diameter_mm": 14,
      "cross_section_area_mm2": 153.9,
      "mass_per_m_kg": 1.208,
      "mass_per_12m_kg": 14.496
    },
    {
      "row_id": "rebar-kg-per-m:_:16",
      "diameter_mm": 16,
      "cross_section_area_mm2": 201.1,
      "mass_per_m_kg": 1.579,
      "mass_per_12m_kg": 18.948
    },
    {
      "row_id": "rebar-kg-per-m:_:18",
      "diameter_mm": 18,
      "cross_section_area_mm2": 254.5,
      "mass_per_m_kg": 1.998,
      "mass_per_12m_kg": 23.976
    },
    {
      "row_id": "rebar-kg-per-m:_:20",
      "diameter_mm": 20,
      "cross_section_area_mm2": 314.2,
      "mass_per_m_kg": 2.466,
      "mass_per_12m_kg": 29.592
    },
    {
      "row_id": "rebar-kg-per-m:_:22",
      "diameter_mm": 22,
      "cross_section_area_mm2": 380.1,
      "mass_per_m_kg": 2.984,
      "mass_per_12m_kg": 35.808
    },
    {
      "row_id": "rebar-kg-per-m:_:25",
      "diameter_mm": 25,
      "cross_section_area_mm2": 490.9,
      "mass_per_m_kg": 3.854,
      "mass_per_12m_kg": 46.248
    },
    {
      "row_id": "rebar-kg-per-m:_:28",
      "diameter_mm": 28,
      "cross_section_area_mm2": 615.8,
      "mass_per_m_kg": 4.834,
      "mass_per_12m_kg": 53.008
    },
    {
      "row_id": "rebar-kg-per-m:_:32",
      "diameter_mm": 32,
      "cross_section_area_mm2": 804.2,
      "mass_per_m_kg": 6.313,
      "mass_per_12m_kg": 75.755
    },
    {
      "row_id": "rebar-kg-per-m:_:35",
      "diameter_mm": 35,
      "cross_section_area_mm2": 962.1,
      "mass_per_m_kg": 7.553,
      "mass_per_12m_kg": 90.636
    },
    {
      "row_id": "rebar-kg-per-m:_:38",
      "diameter_mm": 38,
      "cross_section_area_mm2": 1134.1,
      "mass_per_m_kg": 8.903,
      "mass_per_12m_kg": 106.836
    }
  ]
}